<?xml version="1.0" encoding="UTF-8"?>

<?xml-stylesheet type="text/xsl" href="employees.xsl"?>

<!DOCTYPE employees SYSTEM "employees.dtd">

<employees xmlns:xsi="http://www.w3.org/2001/XMLSchema-instance"
           xsi:noNamespaceSchemaLocation="employees.xsd">

    <employee>
        <emp_id>E001</emp_id>
        <name>Rahul Sharma</name>
        <position>Software Engineer</position>
        <organization>TechNova Pvt Ltd</organization>
        <department>IT</department>
        <salary>75000</salary>
    </employee>

    <employee>
        <emp_id>E002</emp_id>
        <name>Priya Verma</name>
        <position>HR Manager</position>
        <organization>TechNova Pvt Ltd</organization>
        <department>Human Resources</department>
        <salary>68000</salary>
    </employee>

    <employee>
        <emp_id>E003</emp_id>
        <name>Amit Patel</name>
        <position>Accountant</position>
        <organization>TechNova Pvt Ltd</organization>
        <department>Finance</department>
        <salary>62000</salary>
    </employee>

    <employee>
        <emp_id>E004</emp_id>
        <name>Sneha Rao</name>
        <position>Project Manager</position>
        <organization>TechNova Pvt Ltd</organization>
        <department>Operations</department>
        <salary>90000</salary>
    </employee>

    <employee>
        <emp_id>E005</emp_id>
        <name>Vikram Singh</name>
        <position>System Analyst</position>
        <organization>TechNova Pvt Ltd</organization>
        <department>IT</department>
        <salary>72000</salary>
    </employee>

    <employee>
        <emp_id>E006</emp_id>
        <name>Neha Kapoor</name>
        <position>Marketing Executive</position>
        <organization>TechNova Pvt Ltd</organization>
        <department>Marketing</department>
        <salary>58000</salary>
    </employee>

    <employee>
        <emp_id>E007</emp_id>
        <name>Arjun Mehta</name>
        <position>Business Analyst</position>
        <organization>TechNova Pvt Ltd</organization>
        <department>Business</department>
        <salary>82000</salary>
    </employee>

    <employee>
        <emp_id>E008</emp_id>
        <name>Meera Iyer</name>
        <position>UI/UX Designer</position>
        <organization>TechNova Pvt Ltd</organization>
        <department>Design</department>
        <salary>67000</salary>
    </employee>

    <employee>
        <emp_id>E009</emp_id>
        <name>Rohan Das</name>
        <position>Data Scientist</position>
        <organization>TechNova Pvt Ltd</organization>
        <department>Analytics</department>
        <salary>95000</salary>
    </employee>

    <employee>
        <emp_id>E010</emp_id>
        <name>Anjali Nair</name>
        <position>Admin Officer</position>
        <organization>TechNova Pvt Ltd</organization>
        <department>Administration</department>
        <salary>50000</salary>
    </employee>

</employees>
